{
  "receipt_schema": "jivo.ingestion-receipt/v1",
  "source_id": "jivo-factory",
  "dataset_id": "dispatch_events",
  "run_id": "01JIVOEXAMPLE000000000001",
  "extract_mode": "incremental",
  "cursor_start": "sample-sequence-100",
  "cursor_end": "sample-sequence-120",
  "source_as_of": "2026-07-17T23:59:59Z",
  "extracted_at_utc": "2026-07-18T00:15:00Z",
  "business_timezone": "Asia/Kolkata",
  "object_uri": "s3://sanitized-example/jivo-factory/dispatch_events/sample-object",
  "media_type": "application/x-parquet",
  "compression": "zstd",
  "bytes": 1024,
  "rows": 20,
  "sha256": "aaaaaaaaaaaaaaaaaaaaaaaaaaaaaaaaaaaaaaaaaaaaaaaaaaaaaaaaaaaaaaaa",
  "schema_fingerprint": "bbbbbbbbbbbbbbbbbbbbbbbbbbbbbbbbbbbbbbbbbbbbbbbbbbbbbbbbbbbbbbbb",
  "extractor_name": "sanitized-fixture-extractor",
  "extractor_version": "fixture-v1",
  "parameters_redacted": {"scope":"sanitized-example"},
  "control_totals": {"completeness_check":"terminal-cursor-confirmed","source_record_count":20,"unique_record_count":20},
  "status": "landed"
}
